{
    "$schema": "http://json-schema.org/draft-04/schema#",
    "type": "object",
    "properties": {
        "name": {
            "type": "string",
            "description": "The name of the contact method"
        },
        "iconClassList": {
            "type": "string",
            "description": "The FontAwesome class list for the contact method's icon"
        },
        "linkDisplayText": {
            "type": "string",
            "description": "The text to display for the contact method"
        },
        "linkUrl": {
            "type": "string",
            "description": "The URL for the contact method"
        },
        "copyText": {
            "type": "string",
            "description": "The text to copy to the clipboard for the contact method"
        }
    }
}